{
  "schema_version": "1.0.0",
  "id": "redirect_01K0ABCDEFFGHJKMNPQRSTVWXF",
  "publication_id": "pub_01K0ABCDEFFGHJKMNPQRSTVWXY",
  "from_path": "/2026/07/20/a-cidade-terceirizou-o-relogio/",
  "to_path": "/2026/07/20/cidade-terceirizou-o-relogio/",
  "status_code": 308,
  "effective_at": "2026-07-20T18:20:00-03:00",
  "reason": "A URL foi encurtada sem alterar o conteúdo editorial."
}
